brand;model;device;topkw;devicetype;screensize;camera;releaseyear;title;meta_desc;description;first_h2;first_h2_description;second_h2;second_h2_description;third_h2;third_h2_description
Apple;iPhone 13;Apple iPhone 13;Cover til Apple iPhone 13;smartphone;6.1;12;2021;Cover til Apple iPhone 13;"Apple iPhone 13 Covers, Etuier & Skærmbeskyttelse. Over 150.000 produkter &#9989; Hurtig Levering &#9989; Pålidelig Service &#9989; Få dit  Apple iPhone 13 cover i dag!";"Den første ting, du skal gøre, efter at du har fået en ny Apple iPhone 13, er at få noget beskyttelse til den, efter du har rodet rundt med indstillingerne og testet kameraet, selvfølgelig.
Nye Apple enhed er gode, men med alt det kraftfuld teknologi pakket ind på så lille et sted, så skal du sørge for at det er sikret. Vi har alt du skal bruge, men det virkelige spørgsmål er - Hvad vil du have?
Et Apple iPhone 13 cover giver beskyttelse på alle siderne af din enhed uden at gå på komprimis med hvor meget den fylder. Det betyder at din Apple iPhone 13 vil passe godt i lommen og din hånd, og du behøver ikke bekymre dig om konsekvenserne af at tabe den, eller at bagsiden vil blive stødt eller ridset.
Vores covers til Apple iPhone 13 fås også i en lang række stilarter, farver og materialer, fordi det ikke kun er vigtigt at holde din telefon beskyttet - den skal også matche din egen individuelle stil, såvel som at passe til enhver lejlighed. Her finder du alt fra slidstærke, enkle hårde covers,  til muntre og farverige silikone covers og meget, meget mere. På den anden side kan en Apple iPhone 13 etui tvinge dig til at ofre lidt i størrelse - men det tilgengæld får du mere alsidighed og beskyttelse. Et etui til dit Apple dækker både forsiden og bagsiden af din Apple iPhone 13 mod stød, ridser og fald. Det indeholder også plads til kort og kontanter, så du kan gemme alle dine værdigenstande ét sted og aldrig behøver at bekymre dig om at glemme noget.
Ligesom med covers findes vores etuier til Apple iPhone 13 i en lang række stilarter, farver og materialer.
Du vil kunne finde noget professionelt og lækkert, som et enfarvet læderetui eller noget mere sjovt og livligt, som en farverig PU-læder etui med pung.
Hvis du ikke er helt sikker på, hvad du foretrækker, eller hvis du føler, at du har brug for begge dele, har vi også Apple iPhone 13 2-i-1 etuier. En 2-i-1 etui samler begge verdener: et aftageligt cover inde i en etui.
Coveret er fastgjort inde i etuiet med en magnet, hvilket betyder, at det forbliver sikkert på plads, men også er let at afmontere og bruge for sig selv. Coverets metal bagside betyder, at det også kan fastgøres til enhver magnetisk overflade, f.eks. Telefonholderen i din bil - det bliver ikke mere alsidigt end det. Vi har også skærmbeskyttere i hårdt hærdet glas. Du finder altså alt her på Lux-case. Klik rundt på siden og find dit cover til Apple iPhone 13 i dag.";Covers til Apple iPhone 13;first_h2_description;Etuier til Apple iPhone 13;second_h2_description;beskyttelsesfilm til Apple iPhone 13;third_h2_description
Samsung;Galaxy S20;Samsung Galaxy S20;Samsung Galaxy S20 Cover;smartphone;6.2;64;2020;Samsung Galaxy S20 Cover;"Samsung Galaxy S20 Covers, Etuier & Skærmbeskyttelse. Over 150.000 produkter &#9989; Hurtig Levering &#9989; Pålidelig Service &#9989; Få dit  Samsung Galaxy S20 cover i dag!";Samsung Galaxy S20 Covers, Etuier og Tilbehør. Her finder du alt, du måtte have brug for til din smartphone. Vi har en stor bunke af forskellige etuier og covers til Samsung Galaxy S20. Alt i forskellige farver, materialer, motiver, og funktioner. Kig igennem Lux-Case og du vil finde alt du nogensinde vil få brug for af tilbehør til Samsung Galaxy S20. Vores forslår at det første du får fat i er et Samsung Galaxy S20 cover i silikone eller TPU, hvilket reducerer chancerne får at din smartphone får daglige skader. Et Samsung Galaxy S20 etui kunne være det rigtige valg til dig, hvis du leder efter et produkt med flere funktioner, og vil stadigvæk beskytte din smartphone. Du kan enda finde læder etuier. Vi har også en masse andet tilbehør til Samsung Galaxy S20, såsom skærmbeskyttelse og sportsarmbånd. Vi har også de laveste priser i Danmark.;Covers til Samsung Galaxy S20;first_h2_description;Etuier til Samsung Galaxy S20;second_h2_description;beskyttelsesfilm og Tilbehør til Samsung Galaxy S20;third_h2_description
Apple;iPhone 12;iPhone 12;Cover til iPhone 12;smartphone;6.1;12;2020;Cover til iPhone 12;Covers, etuier og skærmbeskyttere til iPhone 12. Største & Bedste udvalg af tilbehør til iPhone 12 i Danmark - Få dit i dag!;"Leder du efter et iPhone 12 cover? Velkommen til det største udvalg af iPhone 12 Covers, Etuier og alt andet tilbehør i Danmark. Tag godt om hånd om dig smartphone og lad ikke hverdagens brug, gøre at din smartphone kommer til at se skadet ud. Beskyt din iPhone 12 i dag, så den vil se ud som en ny smartphone i flere år. Vi anbefaler at beskytte din smartphone, med et etui eller cover. Du kan kombinere dem med skærmbeskyttelse for maksimalt beskyttelse. Din iPhone 12 vil holde i langt længere tid, og changen for at få skrammer og skader ved tab er minimeret. Find iPhone 12 etuier og covers i alle dine yndlings farver, motiver, mønstre og materialer. Du vil med garanti finde noget, der passer netop din smag, stil og budget. Brug et cover til iPhone 12 for et mere simpel design, og lade din smartphone se unik ud. Du kan også bruge et iPhone 12 etui og have all siderne på din smartphone beskyttet. Mange af vores iPhone 12 etuier har plads til kreditkort, så det også kan bruges som pung. Vi har ikke kun et gigantisk udvalg af etuier og covers til iPhone 12, faktisk har vi det største udvalg af alt slags tilbehør til iPhone 12 i Danmark. Alt til de laveste priser på markedet. Klik rundt på Lux-case og få mest ud af din smartphone.
";Covers til iPhone 12;first_h2_description;Etuier til iPhone 12;second_h2_description;skærmbeskyttere til iPhone 12;third_h2_description
Apple;iPhone 11 Pro Max;iPhone 11 Pro Max;iPhone 11 Pro Max Covers;smartphone;6.5;12;2019;iPhone 11 Pro Max Covers;"Det bedste udvalg af iPhone 11 Pro Max Covers, Etuier & Skærmbeskyttelse. Over 150.000 produkter &#9989; Hurtig Fragt &#9989; God Service &#9989;";"Der findes mange forskellige typer af iPhone 11 Pro Max covers og det kan være en god ide at beskytte din telefon imod støv, stød og ridser, som kan opstå på en ganske normal hverdag. 
Beskytter du din iPhone 11 Pro Max vil din telefon se pænere ud i længere tid, og du vil undgå at skade den så let.
Nogle etuier til iPhone 11 Pro Max er typisk lavet af plastik eller silikone, som gør dem fleksibel.
Du vil finde mange forskellige mønstre og design på Lux-Case og du kan vælge nøjagtigt det etui, der passer dig bedst.
De mest almindelige etuier beskytter bagsiden af din telefon mod ridser og skrammer. Et godt iPhone 11 Pro Max cover skal være behageligt at holde, og samtidig beskytte din telefon. 
Et cover til iPhone 11 Pro Max kan også være lavet af plast, hvilket normalt gør coveret mere robust i sit udseende. Det er en smagssag, hvad man bedst kan lide. Hos Lux-case er der eksklusive etuier og covers, også er der de mere simple og diskrete. Der er altså noget til enhver smag og ethvert budget. I nogle tilfælde kan et iPhone 11 Pro Max etui være lavet af flere forskellige materialer. Det betyder at nogle etuier, kan have en hård plastskal og kanterne vil være i blødere silikone og plastmateriale.";Covers til iPhone 11 Pro Max;first_h2_description;Etuier til iPhone 11 Pro Max;"Leder du efter et iPhone 11 Pro Max etuier? Vi har alt du kigger efter! Med stor variation, når det kommer til iPhone 11 Pro Max etuier. Et etui med pung er det bedste af to verdener og kombinerer både pung og flip etui, så kan du slippe for at have begge med, samtidig med at fronten og bagsiden på din mobil er beskyttet. Et pung etui til iPhone 11 Pro Max kommer med indbygget kortholder, hvor du kan holde dine kort og sedler. Etuiet lukker tæt til med magnet eller lås, så de mest vigtige ejendele er sikkert og beskyttet. Vi har også iPhone 11 Pro Max flip etuier, hvor bagklappen kan foldes og virker derfor også som en stander - Perfekt til at se videoer eller se på billeder, uden at skulle holde din iPhone 11 Pro Max i hånden. Hvis du ikke beslutte dig, eller har brug for begge, så har vi iPhone 11 Pro Max 2-i-1 magnetiske etuier, hvor du har et flip etui med et hårdt cover indeni - Mere funktionelt bliver det altså ikke. Uanset hvilket etui du vil have, har vi et godt og bredt udvalg af alle slags stilarter, designs og farver. Alt fra det helt simple og professionelle look til det helt udtryksfulde og massere af farver. Du kan også finde et stort sortiment af forskellige materialer til dit telefon etui. Vil du have din iPhone 11 Pro Max i luksuriøs og ægte læder, eller måske kunstlæder? Måske du hellere vil have noget mere enkelt som et stof etui eller silikone case. Uanset hvad; Vi har hvad du leder efter! ";skærmbeskyttere til iPhone 11 Pro Max;third_h2_description
Huawei;P30;Huawei P30;Etuier til Huawei P30;smartphone;6.1;40;2019;Etuier til Huawei P30;Covers, etuier og skærmbeskyttere til Huawei P30. Største & Bedste udvalg af tilbehør til Huawei P30 i Danmark - Få dit i dag!;"Leder du efter et Huawei P30 cover? Velkommen til det største udvalg af Huawei P30 Covers, Etuier og alt andet tilbehør i Danmark. Tag godt om hånd om dig smartphone og lad ikke hverdagens brug, gøre at din smartphone kommer til at se skadet ud. Beskyt din P30 i dag, så den vil se ud som en ny smartphone i flere år. Vi anbefaler at beskytte din smartphone, med et etui eller cover. Du kan kombinere dem med skærmbeskyttelse for maksimalt beskyttelse. Din Huawei P30 vil holde i langt længere tid, og changen for at få skrammer og skader ved tab er minimeret. Find Huawei P30 etuier og covers i alle dine yndlings farver, motiver, mønstre og materialer. Du vil med garanti finde noget, der passer netop din smag, stil og budget. Brug et cover til P30 for et mere simpel design, og lade din smartphone se unik ud. Du kan også bruge et P30 etui og have all siderne på din smartphone beskyttet. Mange af vores Huawei P30 etuier har plads til kreditkort, så det også kan bruges som pung. Vi har ikke kun et gigantisk udvalg af etuier og covers til Huawei P30, faktisk har vi det største udvalg af alt slags tilbehør til Huawei P30 i Danmark. Alt til de laveste priser på markedet. Klik rundt på Lux-case og få mest ud af din smartphone.
";Covers til Huawei P30;first_h2_description;Etuier til Huawei P30;second_h2_description;skærmbeskyttere til Huawei P30;third_h2_description
OnePlus;7 Pro;OnePlus 7 Pro;OnePlus 7 Pro Etuier og covers;smartphone;6.67;48;2019;OnePlus 7 Pro Etuier og covers;Leder du efter covers, etuier og tilbehør til OnePlus 7 Pro? Vi har (næsten) alt hvad du leder efter. Det største udvalg i Danmark.;"Den første ting, du skal gøre, efter at du har fået en ny OnePlus 7 Pro, er at få noget beskyttelse til den, efter du har rodet rundt med indstillingerne og testet kameraet, selvfølgelig.
Nye OnePlus mobil er gode, men med alt det kraftfuld teknologi pakket ind på så lille et sted, så skal du sørge for at det er sikret. Vi har alt du skal bruge, men det virkelige spørgsmål er - Hvad vil du have?
Et OnePlus 7 Pro cover giver beskyttelse på alle siderne af din mobil uden at gå på komprimis med hvor meget den fylder. Det betyder at din OnePlus 7 Pro vil passe godt i lommen og din hånd, og du behøver ikke bekymre dig om konsekvenserne af at tabe den, eller at bagsiden vil blive stødt eller ridset.
Vores covers til OnePlus 7 Pro fås også i en lang række stilarter, farver og materialer, fordi det ikke kun er vigtigt at holde din telefon beskyttet - den skal også matche din egen individuelle stil, såvel som at passe til enhver lejlighed. Her finder du alt fra slidstærke, enkle hårde covers,  til muntre og farverige silikone covers og meget, meget mere. På den anden side kan en OnePlus 7 Pro etui tvinge dig til at ofre lidt i størrelse - men det tilgengæld får du mere alsidighed og beskyttelse. Et etui til dit OnePlus dækker både forsiden og bagsiden af din OnePlus 7 Pro mod stød, ridser og fald. Det indeholder også plads til kort og kontanter, så du kan gemme alle dine værdigenstande ét sted og aldrig behøver at bekymre dig om at glemme noget.
Ligesom med covers findes vores etuier til OnePlus 7 Pro i en lang række stilarter, farver og materialer.
Du vil kunne finde noget professionelt og lækkert, som et enfarvet læderetui eller noget mere sjovt og livligt, som en farverig PU-læder etui med pung.
Hvis du ikke er helt sikker på, hvad du foretrækker, eller hvis du føler, at du har brug for begge dele, har vi også OnePlus 7 Pro 2-i-1 etuier. En 2-i-1 etui samler begge verdener: et aftageligt cover inde i en etui.
Coveret er fastgjort inde i etuiet med en magnet, hvilket betyder, at det forbliver sikkert på plads, men også er let at afmontere og bruge for sig selv. Coverets metal bagside betyder, at det også kan fastgøres til enhver magnetisk overflade, f.eks. Telefonholderen i din bil - det bliver ikke mere alsidigt end det. Vi har også skærmbeskyttere i hårdt hærdet glas. Du finder altså alt her på Lux-case. Klik rundt på siden og find dit cover til OnePlus 7 Pro i dag.";Covers til OnePlus 7 Pro;first_h2_description;Etuier til OnePlus 7 Pro;second_h2_description;beskyttelsesfilm til OnePlus 7 Pro;third_h2_description
OnePlus;8;OnePlus 8;Covers & Beskyttelse til OnePlus 8;smartphone;6.55;48;2020;Covers & Beskyttelse til OnePlus 8;Har du brug for et OnePlus 8 Cover, Case eller Tilbehør? Du er kommet til det rigtige sted! Vi har alt hvad du behøver og mere til;OnePlus udgav deres 8 i 2020. Hvis ikke du vil risikere ridser på din nye mobils  6.55 tommer skærm, så vil du beskytte din OnePlus 8. Se alle vores etuier, covers og beskyttelsesfilm deres passer perfekt til din mobil.;Covers til OnePlus 8;first_h2_description;Etuier til OnePlus 8;second_h2_description;beskyttelsesfilm til OnePlus 8;Er der noget værre end en ridse på din OnePlus 8 skærm? Vær sikker på at holde din mobiltelefon fri for ridser, blænding og skidt med en OnePlus 8 beskyttelsesfilm. Uanset om du har brug for skærmbeskyttelse i hærdet glas eller plastik film, så er de altid nemme og påsætte og fjerne igen. Hold altid din OnePlus 8 skærm til at se fabriksny ud.
Xiaomi;Redmi S2;Xiaomi Redmi S2;Xiaomi Redmi S2 covers;smartphone;5.99;12;2018;Xiaomi Redmi S2 covers;Covers, etuier og skærmbeskyttere til Xiaomi Redmi S2. Største & Bedste udvalg af tilbehør til Xiaomi Redmi S2 i Danmark - Få dit i dag!;"Få et Xiaomi Redmi S2 cover og forlæng din enhed levetid.
Når du vælger at købe en dyr enhed, er det super ærgeligt hvis du uheldigvis skulle komme til at skade den.
En reparation kan være meget dyr, og det er aldrig særligt sjovt at kigge på sin enhed, når bagsiden er fyldt med ridser.
Hos Lux-case finde du utroligt mange gode Xiaomi Redmi S2 covers, der beskytter bagsiden på din enhed helt optimalt. Covers forhindrer bagsiden i at blive ridset og skadet.

Lux-case tilbyder et stort udvalg af forskellige typer af etuier og covers.
Du kan finde etuier lavet af hårdt plastik, hvilket giver super holdbarhed, samt et sejt og robust udseende til din enhed.

Hvis du er mere til et elegant og stilfuldt design, kan du også finder etuier til har dette.
Mange af vores covers er lavet af blødt silikone og plastik, hvilket giver fleksibilitet og gør dem komfortabel at holde i hånden. Nogle af vores etuier til Xiaomi Redmi S2 er designet til at bevare det naturlige udseende. De kan være lavet af klar plastik, så din enhed stadigvæk kan ses. Andre er ultra tynde, så din enhed ikke føles stor og tung.
Nogle af de Xiaomi Redmi S2 etuier på Lux-case har også en stander og/eller en kreditkort holder monteret. De fleste er dog designet til først og fremmest at beskytte din enhed fra ridser og stød.

Der er en bunke af sjove motiver tilgængelig på etuier. Nogle er med farverigt mønster, andre med printet motiv. Hvis du vil have et mere business look, er dette også muligt. Der er noget til alle og enhver og i forskellige pris niveauer. Alle beskytter din enhed.";Covers til Xiaomi Redmi S2;first_h2_description;Etuier til Xiaomi Redmi S2;second_h2_description;beskyttelsesfolie til Xiaomi Redmi S2;third_h2_description
Xiaomi;Mi 6;Xiaomi Mi 6;Cover Xiaomi Mi 6;smartphone;5.15;12;2017;Cover Xiaomi Mi 6;"Køb Covers, Etuier & Skærmbeskyttelse til Xiaomi Mi 6. Over 150.000 Produkter &#9989; Hurtig Fragt &#9989; Pålidelig Service &#9989; Få dit Xiaomi Mi 6 Cover i dag!";"Den første ting, du skal gøre, efter at du har fået en ny Xiaomi Mi 6, er at få noget beskyttelse til den, efter du har rodet rundt med indstillingerne og testet kameraet, selvfølgelig.
Nye Xiaomi mobil er gode, men med alt det kraftfuld teknologi pakket ind på så lille et sted, så skal du sørge for at det er sikret. Vi har alt du skal bruge, men det virkelige spørgsmål er - Hvad vil du have?
Et Xiaomi Mi 6 cover giver beskyttelse på alle siderne af din mobil uden at gå på komprimis med hvor meget den fylder. Det betyder at din Xiaomi Mi 6 vil passe godt i lommen og din hånd, og du behøver ikke bekymre dig om konsekvenserne af at tabe den, eller at bagsiden vil blive stødt eller ridset.
Vores covers til Xiaomi Mi 6 fås også i en lang række stilarter, farver og materialer, fordi det ikke kun er vigtigt at holde din telefon beskyttet - den skal også matche din egen individuelle stil, såvel som at passe til enhver lejlighed. Her finder du alt fra slidstærke, enkle hårde covers,  til muntre og farverige silikone covers og meget, meget mere. På den anden side kan en Xiaomi Mi 6 etui tvinge dig til at ofre lidt i størrelse - men det tilgengæld får du mere alsidighed og beskyttelse. Et etui til dit Xiaomi dækker både forsiden og bagsiden af din Xiaomi Mi 6 mod stød, ridser og fald. Det indeholder også plads til kort og kontanter, så du kan gemme alle dine værdigenstande ét sted og aldrig behøver at bekymre dig om at glemme noget.
Ligesom med covers findes vores etuier til Xiaomi Mi 6 i en lang række stilarter, farver og materialer.
Du vil kunne finde noget professionelt og lækkert, som et enfarvet læderetui eller noget mere sjovt og livligt, som en farverig PU-læder etui med pung.
Hvis du ikke er helt sikker på, hvad du foretrækker, eller hvis du føler, at du har brug for begge dele, har vi også Xiaomi Mi 6 2-i-1 etuier. En 2-i-1 etui samler begge verdener: et aftageligt cover inde i en etui.
Coveret er fastgjort inde i etuiet med en magnet, hvilket betyder, at det forbliver sikkert på plads, men også er let at afmontere og bruge for sig selv. Coverets metal bagside betyder, at det også kan fastgøres til enhver magnetisk overflade, f.eks. Telefonholderen i din bil - det bliver ikke mere alsidigt end det. Vi har også skærmbeskyttere i hårdt hærdet glas. Du finder altså alt her på Lux-case. Klik rundt på siden og find dit cover til Xiaomi Mi 6 i dag.";Covers til Xiaomi Mi 6;first_h2_description;Etuier til Xiaomi Mi 6;second_h2_description;beskyttelsesfolie til Xiaomi Mi 6;third_h2_description
Apple;iPad Mini (2021);iPad Mini (2021);Cover til iPad Mini (2021);tablet;8.3;8;2021;iPad Mini (2021) Etuier, Covers & Skærmbeskyttelse;"Covers, Etuier & Beskyttelse til iPad Mini (2021). Største iPad Mini (2021) Udvalg i Danmark &#9989; Hurtig Fragt &#9989; Høj Service &#9989; Find dit iPad Mini (2021) cover i dag! ";Vi gætter på at iPad Mini (2021) har ændret dit liv. Det har i hvert fald ændret vores, og vi takker Apple for at have lavet den. Med en kombination af de bedste dele ved en computer og telefon, har tabletten ændret måden vi interagerer med internettet for altid. Det gælder hvis du bruger din iPad Mini (2021) til at streame film og TV-serier, som en lettere og mindre version af en bærbar til skole eller arbejde, eller til at tjekke de sociale medier - Hvis du er ligesom os, så bruger du den til alle tre ting. Men ligesom med din smartphone, så er det vigtigt at holde din tablet sikker og personlig, fordi det ikke bare er et værktøj, til at gøre dit liv nemmere, det er også et tilbehør. Her finder du et bredt udvalg af cover, etuier og skærmbeskyttere til iPad Mini (2021). Uanset hvad du leder efter, så kan du finde det her. Vi har farverige og iPad Mini (2021) flipcovers med masser af udtryk, i alle slags designs og mønstre, der både passer til din personlighed og holder din Apple sikker. Vi har også simple og slanke silikone og plastik iPad Mini (2021) etuier, der ikke fylder så meget, mens din iPad Mini (2021) er beskyttet. Og nu når vi er inde på at holde din iPad Mini (2021) sikker, så kan den også altid se ud som ny, med vores gode sortiment af iPad Mini (2021) skærmbeskyttelse i både hærdet glas og plastik folie.;Cover til iPad Mini (2021);At have et iPad Mini (2021) cover føles så naturligt, er det helt mærkelig at forestille sig uden et. Når alt kommer til alt, så beskytter du din telefon med et cover eller et etui, så hvorfor ikke også gøre det med noget, som du bruger ligeså meget, som mobilen. Derudover, så er den bevægelse, at lukke et cover over skærmen, når du er færdig med at bruge den, en instinktiv bevægelse - Ligesom når du lukker en laptop eller slukker skærmen. Udover at det føles naturlig og instinktivt, så er det også en smart måde at holde din iPad Mini (2021) beskyttet og sikker, og siden din enhed kommer til at være derhjemme eller ved din side hele tiden, så hvorfor ikke få den til at se personlig ud? Så er du i hvert fald kommer til det helt rigtige sted. Vi har iPad Mini (2021) covers i alt fra klassiske, professionelle, læderetuier til de mere livlige og vovet  covers med designs og print. Og for god ordens skyld, et iPad Mini (2021) trifold cover, kan blive foldet tilbage og bruges som stativ, så kan du bruge den håndfri. Og fordi vi vil have, at du skal have muligheden, for at have din egen unikke stil, kan alle vores iPad Mini (2021) covers findes i et kæmpe udvalg af farver og designs.;Etuier til iPad Mini (2021);Et iPad Mini (2021) etui lader dig holde det enkelt, mens din tablet også er sikker og personlig. Du har måske købt din iPad Mini (2021), så du ikke skal slæbe din laptop med i skole eller til kontoret, og derfor ønsker at holde det let, mens den passer perfekt i din taske eller hånd. Et tablet etui giver en slank og enkelt udtryk, uden du skal gå på kompromis med stil eller personlighed. Selvom du kun bruger din iPad Mini (2021), derhjemme, så er det godt at have den beskyttet, med noget så du også har et bedre greb og den ligger bedre i din hånd. Når det kommer til etuier til tablets, så har vi alt du leder efter. Måske er du på udkig efter et minimalistisk iPad Mini (2021) etui i fleksibelt silikone eller et non-slip etui. Måske leder du efter noget mere robust, der giver ekstra beskyttelse, som et iPad Mini (2021) stødsikkert hybrid etui, der også fungerer som et stativ - Perfekt til at se film. Og fordi vi ved hvor meget, de kan lide at bruge deres iPad Mini (2021) til at spille spil eller se videoer, så har vi også sikre og farverige iPad Mini (2021) etuier til børn - Både iPad Mini (2021) etuier til piger og drenge. Uanset hvilket etui, du leder efter, så vi dem i et bredt udvalg af både farver og designs - Så kan dit iPad Mini (2021) være helt personlig.;Skærmbeskyttelse og Tilbehør til iPad Mini (2021);Selvom din iPad Mini (2021) er et perfekt stykke teknologi til at scrolle internettet, se film eller gøre dit arbejde - Så er den også modtagelig overfor skrammer og pletter. Det ved du især, hvis du bruger din tablet til at underholde børnene i bilen, eller distraheret når du laver mad. Men bare rolig: Vi har alt hvad du har bruge til iPad Mini (2021) beskyttelse. Her finder du vores udvalg af iPad Mini (2021) skærmbeskyttelse og tilbehør, både i plastik og hærdet glas. Leder du efter noget til at få din iPad Mini (2021) til at se fabriksny ud, så vent ikke på skrammer og ridser - Beskyt din tablet i dag!
