title;meta_desc;description;first_h2;first_h2_description;second_h2;second_h2_description;third_h2;third_h2_description
"[DEVICE] Cover, Cases & Screen Protectors &#129351; ";"[DEVICE] Cover, Cases & Screen Protectors. Over 150 thousand products &#9989; Fast delivery &#9989; Reliable service &#9989; Find your [DEVICE] cover today!";Looking for a [DEVICE] cover? Welcome to the largest selection of [DEVICE] Covers, Cases and all other kinds of accessories in [COUNTRY].Take good care of your [DEVICETYPE] and don't let everyday use make your [DEVICETYPE] look damaged. Have your [MODEL] protected today, so it will have feel and look like a new [DEVICETYPE], for years to come.We recommend protecting your [DEVICETYPE], with a case or cover. You can combine them with a screen protector for maximum protection.Your [DEVICE] will last much longer, and your chances of getting scratches and fall damage are minimized.Find [DEVICE] cases and covers in your favorite colors, motives, patterns, and materials.You will with guarantee find something, that will suit your taste, style and budget.Use a cover for [MODEL] for a more simple design, and make your [DEVICETYPE] more unique.You can also use a [MODEL] case and have all sides if your [DEVICETYPE] protected. A lot of our [DEVICE] cases have storage for your credit cards, so it will also work as a wallet.Not only do we have a giant selection of Cases and Covers for [DEVICE], actually we have the largest selection of all kinds of accessories for [DEVICE] in [COUNTRY]. All with lowest prices on the market. Click around on Lux-case and get the most out of your [DEVICETYPE].;Covers for [DEVICE];Looking for a [DEVICE] covers? You’ve come to the right place. A mobilecover for [DEVICE] allows you to keep it simple while still keeping your [DEVICE] safe and secure. Here you’ll find our wide selection of flexible plastic and silicone covers that attach snugly to your phone and don't take up much space in your pocket. You can also find covers in leather, carbon, canvas, nylon, glass - and even wood! Some of our [DEVICE] covers also include a popsocket attached to the back which keeps your device secure and comfortable in your hand. We also have a variety of bumpers, if you want to be minimalistic. You can find our [DEVICE] covers in (almost) every colour and design you can imagine, from more aesthetic covers to plain one colour covers - and if you want to skip the colour and design all together we also, of course, have transparent covers.;Cases for [DEVICE];Looking for [DEVICE] cases? We have what you are looking for. There’s a lot of variety when it comes to [DEVICE] phone cases. A wallet case is the best of both worlds and combines both a wallet and a flip case, so that you can skip bringing both - while also protecting the front and back of your phone. Wallet cases for [DEVICE] come with a cardholder where you can keep your cards and money, and it closes with a magnet or a latch, so that your most important possessions are always safe and secure. We also have [DEVICE] flip cases where the front is folded back and then works as a stand - perfect for watching videos and looking at photos without having to hold your [DEVICE] in your hands. And if you can’t decide, or maybe need both, we have [DEVICE] 2-in-1 magnetic cases, which is a flip case with a hard cover inside - it doesn’t get more functional than that! No matter what case you want, we have a wide selection of styles,designs and colours. Everything from simple and professional to expressive and colourful. You can also find a wide assortment of materials for your phone case. Do you want your [DEVICE] in luxurious authentic leather, or maybe artificial PU-leather? Maybe you want something a bit more simple like a canvas case, or silicone case? Either way, we have what you are looking for!;[P_SCREENPROTECTOR] and Accessories for [DEVICE];Is there anything worse than a scratch on the screen of your [DEVICE]? Make sure to keep your phone free from scratches, glares and smudges with a [DEVICE] screen protector. Whether you want a screen protector in tempered glass or plastic film they’re always easy to attach and remove, and always keep your [DEVICE] looking fresh and new.
[DEVICE] Covers, Cases, and Accessories;"[DEVICE] Covers, Cases & Screen Protectors. Over 150 thousand products &#9989; Fast delivery &#9989; Reliable service &#9989; Find all [DEVICE] accessories at lux-case.";Every kind of [DEVICE] covers, cases and Accessories. Here you'll find everything you need for your [DEVICETYPE]. We have lots of different cases and covers for [DEVICE]. All in different colors, materials, motifs and functions. Browse through Lux-Case and you'll find everything you'll ever need in accessories for [DEVICE]. Our suggestion is first to get a [DEVICE] cover in silicone or TPU, which reduces the chances for your [DEVICETYPE] to get daily scratches. A [DEVICE] case might also be the right choice for you if you are looking for a product that has more functions, and still will be protection your [DEVICETYPE]. You can even find leather cases. We also have a lot of other accessories for [DEVICE], including screen protectors and sports armbands. We have the lowest prices in [COUNTRY];Covers for [DEVICE];first_h2_description;Cases for [DEVICE];second_h2_description;[P_SCREENPROTECTOR] for [DEVICE];third_h2_description
[DEVICE] Cover, Cases, and Accessories;"[[DEVICE] Cover, Cases & Screen Protectors. Over 150 thousand products &#9989; Fast delivery &#9989; Reliable service &#9989;";Get a [DEVICE] cover and expand the life of you [DEVICETYPE]When you choose to buy an expensive [DEVICETYPE], is it super annoying if you accidentally smash it. A fix can be very expensive and it is never comfortable to look at a [DEVICETYPE] that is full of scratches on the back.At Lux-case you can get many good [DEVICE] covers, that protect the back of the phone optimally. These covers prevent the back from getting ugly and scratched.We offer a wide range of different types of cases and covers. You can get cases made of hard plastic, which gives super durability and a cool and robust look to your [DEVICETYPE]. If you are more into an elegant and stylish design, you can also find cases that meet it.Many of the covers are made of soft silicone and plastic, which partly gives them flexibility and partly makes them very comfortable to hold in the hand. Some of the cases for [DEVICE] are designed to retain the natural look of the [DEVICETYPE]. They can be made of clear plastic where you can see the phone through. Others are ultra-thin so your [DEVICETYPE] is not going to feel big and heavy.Some [DEVICE] cases on Lux-case have also mounted a stand or a card pocket. But most are just designed to protect the [DEVICETYPE] from scratches and bumps.There are a bunch of fun motifs available on the cases. Some are colorful patterns while others are 3D printed motifs. If you want an elegant design with a business look, this is also possible. There is something for everyone and in different price ranges. But the same for all of them is that they protect your [DEVICETYPE] from everyday hardships.;Covers for [DEVICE];first_h2_description;Cases for [DEVICE];second_h2_description;[P_SCREENPROTECTOR] for [DEVICE];third_h2_description
"[DEVICE] Cover, Cases & Screen Protectors &#129351; ";"[DEVICE] Covers, Cases & Screen Protectors. Over 150 thousand products &#9989; Fast delivery &#9989; Reliable service &#9989; Find your [DEVICE] cover today!";There are many different types of [DEVICE] covers and it may be a good idea to use one to better protect your [DEVICETYPE] from dust, bumps and scratches that occur in everyday life. This allows you to keep your [DEVICETYPE] nicer for longer and avoid smashing it so easily.Some good cases for [DEVICE] are typically made of plastic and silicone that is flexible. You will find many different patterns and designs on Lux-Case and can choose exactly the case that suits you best. The regular cases usually protect the back of your phone from scratches and scuffs. A good [DEVICE] case should be comfortable to hold, while providing protection for your [DEVICETYPE]. [DEVICE] can also be made of plastic, which usually makes the case more robust in its appearance. It's a matter of taste what one likes best. At Lux-case there are exclusive cases and ordinary types, so there is something for every taste and budget.;Covers for [DEVICE];first_h2_description;Cases for [DEVICE];second_h2_description;[P_SCREENPROTECTOR] for [DEVICE];third_h2_description
"[DEVICE] Cover, Cases and Accessories &#10003;";"Looking for covers, cases and accessories for [DEVICE]? We have (almost) everything you’re searching for, and the widest selection in [COUNTRY]. &#10003;";Is it time for a new [DEVICE] cover or case? Maybe a screen protector, to keep your [BRAND] looking as new and shiny as the day you bought it? No matter what you are looking for, you’ve come to the right place. We have everything from sleek and simple [DEVICE] covers that lets you personalize your phone, while still keeping it safe and secure from scratches and bumps, to durable wallet cases that lets you keep all your valuables in one place. The great thing about a cover for [DEVICE] is that it offers protection and style, without taking up any excessive space in your pocket. A cover is therefore the way to go if you want something simple and light, something that integrates seamlessly and sits comfortably in the palm of your hand, without wanting to sacrifice the integrity of your [DEVICE]. A [DEVICE] case, on the other hand, takes up a little more space but offers more versatility - such as pockets for your cards and cash, as well as protection for your [DEVICETYPE] screen. A case for [DEVICE] is the preferred option if you want to organize all your valuables into one convenient place that also offers protection. For those who can’t decide, or simply want both, we also have convenient 2-in-1 covers. A 2-in-1 cover for [DEVICE] is a detachable case inside of a wallet cover. The case itself attaches to the cover with a magnet, which is not only smart but makes sure that your [DEVICE] is always safe and secure. The magnetic cover is also versatile and can be used on any metallic surface, such as the holder in your car or on your bike. All of our [DEVICE] accessories can be found in a wide selection of materials, colours and styles - all to make sure you can find the perfect fit for your unique style, and needs. To make sure that your screen stays as clean and free-of-scratches as the day you bought it, we also have a selection of different [DEVICE] screen protectors. You can find these is durable and tough tempered glass, or soft, easy-to-apply TPU. ;Covers for [DEVICE];first_h2_description;Cases for [DEVICE];second_h2_description;[P_SCREENPROTECTOR] for [DEVICE];third_h2_description
[DEVICE] Cases, Covers & Accessories;Need a [DEVICE] cover, case or accessory? You have come to the right place! We have everything you need, and some extras. ;The first thing you need to do after getting a new [DEVICE] is get some protection for it, after messing around with the settings and testing out the camera, of course. New [BRAND] phones are great, but with that much powerful technology packed into such a small place, you need to make sure that it’s safe and secure. We have everything you need, but the real question is - what do you want? A [DEVICE] cover offers protection to the back, and sides, of your phones without compromising on any space. This means that your [DEVICE] will still fit neatly in your pocket, and your hand, and you don’t have to worry about the consequences of dropping it, or the back of it getting bumped or scratched in your pocket. Our covers for [DEVICE] are also available in a wide variety of styles, colours and materials because it’s not only important to keep your phone protected - it also has to match your own individual style, as well as every occasion. Here you will find everything from durable, simple hardcovers to cheerful and colorful silicone covers, and much, much more. On the other hand, a [DEVICE] case may force you to sacrifice a little in size - but it compensates with versatility and protection. A case for your [BRAND] covers both the front and the back of your [DEVICE] from bumps, scratches and falls. It also contains slots for cards and cash, so that you can keep all your valuables in one place and never have to worry about forgetting something. Just like with the covers, our cases for [DEVICE] come in a wide variety of styles, colours and materials. You’ll be able to find something professional and sleek, like a single-colour leather case or something more fun and lively, like a colorful PU-leather wallet case. If you’re not entirely sure which you prefer, or if you feel like you need both, we also have [DEVICE] 2-in-1 cases. A 2-in-1 case is a merging of both worlds: a detachable cover inside of a wallet case. The cover is attached inside the wallet case with a magnet, which means it stays securely in place but is also easy to detach and use on its own. The metallic back of the cover means that it can also be attached to any magnetic surface, such as the phone holder in your car - it doesn’t get more versatile than that. We also have screen protectors in tough tempered glass, and easy-to-apply TPU. ;Covers for [DEVICE];first_h2_description;Cases for [DEVICE];second_h2_description;[P_SCREENPROTECTOR] for [DEVICE];third_h2_description
[DEVICE] Covers, Cases & Accessories;Looking for some [BRAND] accessories? You have come to the right place! Here you will find [COUNTRY]'s best selection of covers, cases and screen protectors for [DEVICE].;If you're in need of a [DEVICE] cover or other accessories for your [DEVICETYPE], then you're at the right place.Is there anything more frustrating than a scratch or dent on your [DEVICE]? A scratch on the screen may affect the functionality of your phone, but a scratch, dent or bump anywhere may not only harm the delicate technology on the inside, it will also make [DEVICETYPE] look less presetine than the day you purchased it. Walking around with that much technology, and memories, in your pocket or purse all day, it makes sense that you want to protect it - and we have everything you need. A cover for [DEVICE] may be best suited for someone on the go, as it is lightweight and sleek, and offers protection to the back and sides of your [BRAND] phone. Just like before getting the cover, your [DEVICE] will fit perfectly in your pocket and hand, but it will be more protected from scratches, bumps and day-to-day wear and tear than before. Our covers come in a wide selection of styles, colours and materials - all to make sure that you find something that fits you just right. A case for [DEVICE] is, on the other hand, for the more organized among us. A case not only offers protection to the front, back and sides of your phone, it also comes with wallet slots, so that you can keep your phone, cash, phone and other valuables safely in one place. Cases tend to be slightly bulkier than a cover, but what they add in size they more than make up for in functionality. Just as with our selection for the covers, our cases for [DEVICE] come in a wide variety of colours, materials and styles so that you can find your perfect fit. Shop around for anything from elegant genuine leather, colourful PU-leather or durable silicone. If both of these options sound good to you, and you are having trouble deciding, we have a solution for you: the 2-in-1 case. A [DEVICE] 2-in-1 case is a magnetic cover attached inside a wallet case. The clever magnetic solution means that the cover is detachable and can be used on its own - which means you get the best of both worlds. To make sure that the screen of your [BRAND] remains as clean and free of scratches and smudges as the day you bought it, we also have a selection of [DEVICE] screen protectors, in both durable tempered glass and simple, easy-to-use TPU film. ;Covers for [DEVICE];first_h2_description;Cases for [DEVICE];second_h2_description;[P_SCREENPROTECTOR] for [DEVICE];third_h2_description
[DEVICE] Cover, Cases & Screen Protectors ;Covers, Cases & Screen Protectors for [DEVICE]. Biggest and best selection of accessories for [DEVICE] in [COUNTRY] - find yours today!;Have you ever considered how important protecting your [DEVICE] is? Well, since you’re here, we’re assuming you're looking for a [DEVICE] cover or other accessory. Properly protecting your new [BRAND] phone is not only important because of how powerful, and delicate, this piece of technology you walk around with in your pocket everyday is - it also contains so much information, and so many memories, that it would be difficult to lose. You spend a lot of money, and time, on your [DEVICE], so why not make sure that it’s safe and secure? Don’t worry: we have everything you are looking for and need. We might just have the largest selection of covers for [DEVICE] in [COUNTRY]. A [DEVICE] case is the optimal accessory for those of us who like to keep things organized, and everything in the same, secure, place. A case for [DEVICE] not only protects your phone on all sides, it also comes with wallet functions, which means it contains slots for your cards, cash and other accessories. If that sounds like something you might be interested in, but you’re also looking for more functionality, then a 2-in-1 might be just what you are looking for. A 2-in-1 case for [DEVICE] is a wallet-style case with a cover inside. The cover is attached to the case with a magnet, which means it’s easy to detach from the case and use on its own. You therefore get the best of both worlds: a case and a cover, all in one. Speaking of [DEVICE] covers, we have a wide selection of those as well. A cover for [DEVICE] is a simple and sleek accessory that attaches to the back of your phone, and protects its back and sides. The best thing about a cover is that it doesn’t take up much extra space, which means your [DEVICE] will fit just as smoothly in your pocket and hand as before, but with some extra protection this time. No matter what accessory you are interested in, you will find our entire selection in a wide array of colours, materials and designs. Anything from sturdy and durable to fun and colourful, in anything from tough genuine leather to soft silicone. And don’t forget the most important part: the [DEVICE] screen protector. Make sure that the screen of your phone stays free of scratches, smudges and other damages with a screen protector in either tempered glass or soft TPU.;Covers for [DEVICE];first_h2_description;Cases for [DEVICE];second_h2_description;[P_SCREENPROTECTOR] for [DEVICE];third_h2_description
"[DEVICE] Cases, Covers & Screen Protectors &#129351; ";Protect your [DEVICE] with a Cover, Case or Screen Protector. Or combine them! Find all [DEVICE] accessories at lux-case.;[BRAND] relased their [MODEL] in [RELEASEYEAR]. If you don't wanna risk getting scratches on your new [DEVICETYPE]s  [SCREENSIZE] inch screen, you want protect your [DEVICE]. Look through all of our cases, covers and screen protectors that fits perfectly to your [DEVICETYPE]. Step up ypur case game today!;Covers for [DEVICE];first_h2_description;Cases for [DEVICE];second_h2_description;[P_SCREENPROTECTOR] for [DEVICE];third_h2_description
[DEVICE] Cases, Covers, and Accessories;[DEVICE] Cases, Covers and other Accessories. Cheapest prices and Selection in [COUNTRY]. Protect your [DEVICETYPE] Today!;;Covers for [DEVICE];first_h2_description;Cases for [DEVICE];second_h2_description;[P_SCREENPROTECTOR] for [DEVICE];third_h2_description
[DEVICE] Case, Covers, and Accessories;"[DEVICE] Case, Covers & Screen Protectors. Over 150 thousand products for your [DEVICETYPE]. Fast delivery &#9989; Reliable service &#9989;";;Covers for [DEVICE];first_h2_description;Cases for [DEVICE];second_h2_description;[P_SCREENPROTECTOR] for [DEVICE];third_h2_description
"[DEVICE] Cases, Covers & Screen Protectors &#129351; ";We have all kinds of Cases for [DEVICE]. Protect your [DEVICETYPE] Today, with one or more of our many products for [DEVICE];;Covers for [DEVICE];first_h2_description;Cases for [DEVICE];second_h2_description;[P_SCREENPROTECTOR] for [DEVICE];third_h2_description
[DEVICE] Case, Cover & Accessories;"Cheapest [DEVICE] Cover prices in [COUNTRY]. Protect your [DEVICETYPE] Today. Fast delivery &#9989; Reliable service &#9989;";;Covers for [DEVICE];first_h2_description;Cases for [DEVICE];second_h2_description;[P_SCREENPROTECTOR] for [DEVICE];third_h2_description
[DEVICE] Cases, Covers & Accessories;Giant selection of [DEVICE] Cases, Covers and all other kinds of accessories for your [DEVICETYPE]. Find a Cover that matches your unique style.;;Covers for [DEVICE];first_h2_description;Cases for [DEVICE];second_h2_description;[P_SCREENPROTECTOR] for [DEVICE];third_h2_description
[DEVICE] Case, Cover & Screen Protectors ;"Get your new [DEVICE] Case or Cover Today. Our growing warehouse housesall other kinds of [DEVICE] accessories. Get yours today! &#10003;";;Covers for [DEVICE];first_h2_description;Cases for [DEVICE];second_h2_description;[P_SCREENPROTECTOR] for [DEVICE];third_h2_description
